<?xml version="1.0" encoding="UTF-8" standalone="no"?>

<xs:schema xmlns:xs="http://www.w3.org/2001/XMLSchema" elementFormDefault="qualified">
    <xs:element name="bank" type="bankInfo"/>

    <xs:complexType name="bankInfo" mixed="true">
        <xs:sequence>
            <xs:element name="accounts" minOccurs="1">
                <xs:complexType>
                    <xs:all>
                        <xs:element name="saving_accounts" type="savingAccounts"/>
                        <xs:element name="checking_accounts" type="checkingAccounts"/>
                    </xs:all>
                </xs:complexType>
            </xs:element>
            
            <xs:element name="customers" type="customers" minOccurs="1"/>
            
            <xs:element name="customer_accounts" minOccurs="1">
                <xs:complexType>
                    <xs:sequence>
                        <xs:element name="customer_account" maxOccurs="unbounded">
                            <xs:complexType>
                                <xs:attribute name="c_id" type="xs:IDREF" use="required"/>
                                <xs:attribute name="ac_id" type="xs:IDREF" use="required"/>
                            </xs:complexType>
                        </xs:element>
                    </xs:sequence>
                </xs:complexType>
            </xs:element>
        </xs:sequence>
    </xs:complexType>

    <xs:complexType name="customers">
        <xs:sequence>
            <xs:element name="customer" type="customerInfo" maxOccurs="unbounded"/>
        </xs:sequence>
    </xs:complexType>

    <xs:complexType name="customerInfo">
        <xs:sequence>
            <xs:element name="name" type="xs:string"/>
            <xs:element name="address" type="xs:string"/>
        </xs:sequence>

        <xs:attribute name="id" use="required" type="xs:ID"/>
    </xs:complexType>

    <xs:complexType name="savingAccounts">
        <xs:sequence>
            <xs:element name="saving_account" type="savingAccountInfo" maxOccurs="unbounded"/>
        </xs:sequence>
    </xs:complexType>

    <xs:element name="balance"> 
   	   <xs:simpleType> 
   	   	   <xs:restriction base="xs:decimal"> 
   	   	   	   <xs:minInclusive value="-5000"/> 
   	   	   </xs:restriction> 
   	   </xs:simpleType> 
   </xs:element> 

    <xs:complexType name="savingAccountInfo">
        <xs:sequence>
            <xs:element ref="balance"/>
        </xs:sequence>

        <xs:attribute name="id" use="required" type="xs:ID"/>
        <xs:attribute name="interest" type="xs:decimal"/>
    </xs:complexType>

    <xs:complexType name="checkingAccounts">
        <xs:sequence>
            <xs:element name="checking_account" type="checkingAccountInfo" maxOccurs="unbounded"/>
        </xs:sequence>
    </xs:complexType>

    <xs:complexType name="checkingAccountInfo">
        <xs:sequence>
            <xs:element ref="balance"/>
        </xs:sequence>

        <xs:attribute name="id" use="required" type="xs:ID"/>
    </xs:complexType>
</xs:schema>