<?xml version="1.0" encoding="UTF-8"?> 
<bank xmlns:xsi="http://www.w3.org/2001/XMLSchema-instance" xsi:noNamespaceSchemaLocation="bank.xsd"> 
   <accounts> 
   	   <saving_accounts> 
   	   	   <saving_account id="a1" interest="0.03"> 
   	   	   	   <balance>2500</balance> 
   	   	   </saving_account> 
   	   	   <saving_account id="a2" interest="0.03"> 
   	   	   	   <balance>15075</balance> 
   	   	   </saving_account> 
   	   </saving_accounts> 
   	   <checking_accounts> 
   	   	   <checking_account id="a3"> 
   	   	   	   <balance>4025</balance> 
   	   	   </checking_account> 
   	   	   <checking_account id="a4"> 
   	   	   	   <balance>-125</balance> 
   	   	   </checking_account> 
   	   	   <checking_account id="a5"> 
   	   	   	   <balance>325</balance> 
   	   	   </checking_account> 
   	   </checking_accounts> 
   </accounts> 
   <customers> 
   	   <customer id="c1"> 
   	   	   <name>Ben Richerdson</name> 
   	   	   <address>Park Drive 2</address> 
   	   </customer> 
   	   <customer id="c2"> 
   	   	   <name>Marc Wretcher</name> 
   	   	   <address>Mill Drive 75</address> 
   	   </customer> 
   	   <customer id="c3"> 
   	   	   <name>Angel Steady</name> 
   	   	   <address>Lake Sight 15</address> 
   	   </customer> 
   </customers> 
   <customer_accounts> 
   	   <customer_account c_id="c1" ac_id="a2"/> 
   	   <customer_account c_id="c1" ac_id="a3"/> 
   	   <customer_account c_id="c2" ac_id="a4"/> 
   	   <customer_account c_id="c3" ac_id="a1"/> 
   	   <customer_account c_id="c3" ac_id="a5"/> 
   </customer_accounts> 
</bank>